"Question/Insight","Suitable Chart Type","Relevant Columns"
"Distribution of restaurants by price","Histogram or Bar Chart","PRICE,price_range"
"Popularity of different cuisine categories","Bar Chart or Treemap","CUSINE_CATEGORY"
"Ratings comparison by cuisine type or region","Box Plot or Violin Plot","RATING,CUSINE_CATEGORY,REGION"
"Restaurant popularity by votes","Bar Chart (sorted) or Scatter Plot","VOTES,NAME"
"Average rating by region or cuisine type","Bar Chart or Heatmap","RATING,REGION,CUSINE_CATEGORY"
"Breakdown by restaurant type","Pie Chart or Donut Chart","CUSINE TYPE"
"Operating hours distribution","Histogram or Line Chart (over time)","TIMING"
"Number of restaurants by region","Bar Chart or Map Visualization","REGION,CITY"